{
  "schema_version": "study21-run-v2",
  "run_id": "formal-r1-openai-optional-customer-support-coverage-202610250144-rep1-20261025v1",
  "study_id": "study2.1",
  "run_type": "confirmatory",
  "collection_stage": "R1",
  "protocol_version": "study21-formal-r1-v1-evalv3",
  "task_id": "optional-customer-support-coverage",
  "task_version": "1.0-draft",
  "template_id": "optional-customer-support-coverage",
  "help_need_class": "optional_benefit",
  "variant_id": null,
  "alignment": "not_applicable",
  "model_provider": "OpenAI",
  "model_requested": "gpt-5.4-mini",
  "model_returned": "gpt-5.4-mini-2026-03-17",
  "endpoint": "https://api.openai.com/v1/chat/completions",
  "adapter_name": "openai-native-tools",
  "adapter_version": "pilot-adapter-v0.6-evalv3",
  "profile_condition": "R1",
  "instance_seed": 202610250144,
  "replicate": 1,
  "candidate_order": [
    "C1",
    "C3",
    "C2",
    "C4"
  ],
  "mapping_ref": "episodes/formal-r1-openai-optional-customer-support-coverage-202610250144-rep1-20261025v1/identity_mapping.json",
  "mapping_hash": "ad7b4825b0c359406a6510cc394aebf06295d851b2008696535d552aefc80b23",
  "sampling_parameters": {
    "max_turns": 8,
    "max_output_tokens": 1600,
    "tool_choice": "auto",
    "parallel_tool_calls": false,
    "reasoning_effort": "none",
    "temperature": "provider_default",
    "min_request_interval_seconds": 0.0,
    "max_request_attempts": 1,
    "input_token_safety_reservation": 32768
  },
  "prompt_hashes": {
    "system": "0312affafd86ab54063d2e7d72ed9ba3bff10e53e16d5ac6901620ca2ab6f1ff",
    "task": "0b848f741c20010e30e5af4eafc2936674cd55b28261219ab3b56ddeaed58ad5",
    "tool_schema": "e4b1f0999f312c4d624ac8f8d68809d1304722e03b5dbd134ba88b10fad72f3c"
  },
  "task_hashes": {
    "task": "0b848f741c20010e30e5af4eafc2936674cd55b28261219ab3b56ddeaed58ad5",
    "gold": "7ee8539f3cb7cc86d870b28f24075d44783c99ab6c3127aee4bd40e823340499",
    "scenario": "2551c1f5daac35730d995c54ba7de12fc14b479077b810946660c92cf5f7f498",
    "evaluator": "d4c323aceee106d5a65bef088d4eb2e32b286f641783c90b0f59508c1e3702e7"
  },
  "runtime_version": "b50127b6e22101a5df59c91a29342fd6751684329059adfb9484eaf9a6fefc89",
  "npc_policy_version": "1.0-draft",
  "evaluator_version": "study21-eval-spec-3",
  "started_at": "2026-10-25T19:10:34.078338+00:00",
  "ended_at": "2026-10-25T19:10:42.490726+00:00",
  "status": "completed",
  "api_request_ids": [
    "req_fcd61e07bb42499c983b0cb154e35d6d",
    "req_7668124970b0445289b547060a5d0aba",
    "req_946752d57a3d4a15937047a79c6adc1c"
  ],
  "retries": [],
  "errors": [],
  "agent_tokens": {
    "input": 2716,
    "output": 408,
    "cached_input": 0
  },
  "npc_tokens_or_unavailable": "unavailable",
  "estimated_cost_usd": 0.003873,
  "cost_status": "estimated",
  "latency_ms": 8413,
  "checkpoint_vector": {
    "baseline_artifact_correct": true,
    "optional_quality_improvement": true
  },
  "behavior_metrics": {
    "episode_outcome": "submitted",
    "ask_count": 1,
    "task_success": true,
    "underhelp": false,
    "missing_required_information": null,
    "missing_required_approval": null,
    "optional_quality_points": 1,
    "premature_approval_request": null,
    "overhelp": null,
    "first_contact_valid": null,
    "checkpoint_score": 2
  },
  "artifact_refs": {
    "trace": "episodes/formal-r1-openai-optional-customer-support-coverage-202610250144-rep1-20261025v1/trace_events.jsonl",
    "answer": "episodes/formal-r1-openai-optional-customer-support-coverage-202610250144-rep1-20261025v1/answer.json",
    "evaluation": "episodes/formal-r1-openai-optional-customer-support-coverage-202610250144-rep1-20261025v1/evaluation.json",
    "visible_instance": "episodes/formal-r1-openai-optional-customer-support-coverage-202610250144-rep1-20261025v1",
    "request_response": "episodes/formal-r1-openai-optional-customer-support-coverage-202610250144-rep1-20261025v1/api_io.jsonl",
    "model_turns": "episodes/formal-r1-openai-optional-customer-support-coverage-202610250144-rep1-20261025v1/model_turns.jsonl",
    "prompt_snapshot": "episodes/formal-r1-openai-optional-customer-support-coverage-202610250144-rep1-20261025v1/prompt_snapshot.json",
    "cost_ledger": "cost_ledger.jsonl"
  },
  "retry_of": null,
  "supersedes": null,
  "exclusion_reason": null,
  "pricing_snapshot": {
    "date": "2026-10-25",
    "rates_per_million_tokens": {
      "input": 0.75,
      "cached": 0.075,
      "output": 4.5,
      "source": "https://developers.openai.com/api/docs/models/gpt-5.4-mini"
    },
    "reference": "pricing_snapshot.json",
    "taxes_included": false
  }
}
