{
  "schema_version": "study21-run-v2",
  "run_id": "formal-r0-moonshot-optional-accessible-training-packet-202610250141-rep1-20261025v1",
  "study_id": "study2.1",
  "run_type": "confirmatory",
  "collection_stage": "R0",
  "protocol_version": "study21-formal-r0-v1-evalv3",
  "task_id": "optional-accessible-training-packet",
  "task_version": "1.0-draft",
  "template_id": "optional-accessible-training-packet",
  "help_need_class": "optional_benefit",
  "variant_id": null,
  "alignment": "not_applicable",
  "model_provider": "Moonshot",
  "model_requested": "kimi-k2.6",
  "model_returned": null,
  "endpoint": "https://api.moonshot.ai/v1/chat/completions",
  "adapter_name": "moonshot-native-tools",
  "adapter_version": "pilot-adapter-v0.6-evalv3",
  "profile_condition": "R0",
  "instance_seed": 202610250141,
  "replicate": 1,
  "candidate_order": [
    "C4",
    "C3",
    "C1",
    "C2"
  ],
  "mapping_ref": "episodes/formal-r0-moonshot-optional-accessible-training-packet-202610250141-rep1-20261025v1/identity_mapping.json",
  "mapping_hash": "f08b2e844d2fb1eacaa71dc06e82266843ee8644f88e6d04a7820a82b9ec1c1a",
  "sampling_parameters": {
    "max_turns": 8,
    "max_output_tokens": 1600,
    "tool_choice": "auto",
    "parallel_tool_calls": false,
    "reasoning_effort": "not_set",
    "temperature": "provider_default",
    "min_request_interval_seconds": 21.0,
    "max_request_attempts": 1,
    "input_token_safety_reservation": 32768
  },
  "prompt_hashes": {
    "system": "0312affafd86ab54063d2e7d72ed9ba3bff10e53e16d5ac6901620ca2ab6f1ff",
    "task": "6f7ed4343a5ec396f13aefd73653411507358a1aa246e71a807947b46c803baa",
    "tool_schema": "e4b1f0999f312c4d624ac8f8d68809d1304722e03b5dbd134ba88b10fad72f3c"
  },
  "task_hashes": {
    "task": "6f7ed4343a5ec396f13aefd73653411507358a1aa246e71a807947b46c803baa",
    "gold": "8091dbff01c66a29be443fb713b5df5e8b16bb46aabf8f40e128644629cb80b9",
    "scenario": "640fd303c1133f8f2b4844a737fd75ee64e04837655a496007af985bbc42333c",
    "evaluator": "d4c323aceee106d5a65bef088d4eb2e32b286f641783c90b0f59508c1e3702e7"
  },
  "runtime_version": "2d3be9bbb51c33af0eeefaccf22649a1020a75773e156158799d89d3bcd73d48",
  "npc_policy_version": "1.0-draft",
  "evaluator_version": "study21-eval-spec-3",
  "started_at": "2026-10-25T21:08:58.225444+00:00",
  "ended_at": "2026-10-25T21:14:43.514324+00:00",
  "status": "failed",
  "api_request_ids": [],
  "retries": [],
  "errors": [
    {
      "turn": 0,
      "type": "api_error",
      "detail": "Moonshot request failed: ConnectionResetError"
    }
  ],
  "agent_tokens": {
    "input": 0,
    "output": 0,
    "cached_input": 0
  },
  "npc_tokens_or_unavailable": "unavailable",
  "estimated_cost_usd": null,
  "cost_status": "unavailable",
  "latency_ms": 50051,
  "checkpoint_vector": {
    "baseline_artifact_correct": false,
    "optional_quality_improvement": false
  },
  "behavior_metrics": {
    "episode_outcome": "api_error",
    "ask_count": 0,
    "task_success": false,
    "underhelp": false,
    "missing_required_information": null,
    "missing_required_approval": null,
    "optional_quality_points": 0,
    "premature_approval_request": null,
    "overhelp": null,
    "first_contact_valid": null,
    "checkpoint_score": 0
  },
  "artifact_refs": {
    "trace": "episodes/formal-r0-moonshot-optional-accessible-training-packet-202610250141-rep1-20261025v1/trace_events.jsonl",
    "answer": "episodes/formal-r0-moonshot-optional-accessible-training-packet-202610250141-rep1-20261025v1/answer.json",
    "evaluation": "episodes/formal-r0-moonshot-optional-accessible-training-packet-202610250141-rep1-20261025v1/evaluation.json",
    "visible_instance": "episodes/formal-r0-moonshot-optional-accessible-training-packet-202610250141-rep1-20261025v1",
    "request_response": "episodes/formal-r0-moonshot-optional-accessible-training-packet-202610250141-rep1-20261025v1/api_io.jsonl",
    "model_turns": "episodes/formal-r0-moonshot-optional-accessible-training-packet-202610250141-rep1-20261025v1/model_turns.jsonl",
    "prompt_snapshot": "episodes/formal-r0-moonshot-optional-accessible-training-packet-202610250141-rep1-20261025v1/prompt_snapshot.json",
    "cost_ledger": "cost_ledger.jsonl"
  },
  "retry_of": null,
  "supersedes": null,
  "exclusion_reason": null,
  "pricing_snapshot": {
    "date": "2026-10-25",
    "rates_per_million_tokens": {
      "input": 0.95,
      "cached": 0.16,
      "output": 4.0,
      "source": "https://platform.kimi.ai/docs/pricing/chat"
    },
    "reference": "pricing_snapshot.json",
    "taxes_included": false
  }
}
