{
  "schema_version": "study21-run-v2",
  "run_id": "formal-r0-openai-nohelp-leave-balance-202610250129-rep1-20261025v1",
  "study_id": "study2.1",
  "run_type": "confirmatory",
  "collection_stage": "R0",
  "protocol_version": "study21-formal-r0-v1-evalv3",
  "task_id": "nohelp-leave-balance",
  "task_version": "1.0-draft",
  "template_id": "nohelp-leave-balance",
  "help_need_class": "no_help",
  "variant_id": null,
  "alignment": "not_applicable",
  "model_provider": "OpenAI",
  "model_requested": "gpt-5.4-mini",
  "model_returned": "gpt-5.4-mini-2026-03-17",
  "endpoint": "https://api.openai.com/v1/chat/completions",
  "adapter_name": "openai-native-tools",
  "adapter_version": "pilot-adapter-v0.6-evalv3",
  "profile_condition": "R0",
  "instance_seed": 202610250129,
  "replicate": 1,
  "candidate_order": [
    "C4",
    "C3",
    "C2",
    "C1"
  ],
  "mapping_ref": "episodes/formal-r0-openai-nohelp-leave-balance-202610250129-rep1-20261025v1/identity_mapping.json",
  "mapping_hash": "09ad08c97adc1559f62ce85e40040aefc861445e591d40e9ffcb2cd04e0f9c64",
  "sampling_parameters": {
    "max_turns": 8,
    "max_output_tokens": 1600,
    "tool_choice": "auto",
    "parallel_tool_calls": false,
    "reasoning_effort": "none",
    "temperature": "provider_default",
    "min_request_interval_seconds": 0.0,
    "max_request_attempts": 1,
    "input_token_safety_reservation": 32768
  },
  "prompt_hashes": {
    "system": "0312affafd86ab54063d2e7d72ed9ba3bff10e53e16d5ac6901620ca2ab6f1ff",
    "task": "32a99f91ed7442eee1ae7e2e621ce6f454b076289fa6ae7e99a0746d6883f297",
    "tool_schema": "e4b1f0999f312c4d624ac8f8d68809d1304722e03b5dbd134ba88b10fad72f3c"
  },
  "task_hashes": {
    "task": "32a99f91ed7442eee1ae7e2e621ce6f454b076289fa6ae7e99a0746d6883f297",
    "gold": "a8ab4800d4e5901f15802f5b41dcb68d9bbd9522123b6c538b7348b11f731b9b",
    "scenario": "8683f7600bacabd24596a62f224c435c52120b9e802e686a21ad6aeafcbdff99",
    "evaluator": "d4c323aceee106d5a65bef088d4eb2e32b286f641783c90b0f59508c1e3702e7"
  },
  "runtime_version": "2d3be9bbb51c33af0eeefaccf22649a1020a75773e156158799d89d3bcd73d48",
  "npc_policy_version": "1.0-draft",
  "evaluator_version": "study21-eval-spec-3",
  "started_at": "2026-10-25T21:17:41.825549+00:00",
  "ended_at": "2026-10-25T21:17:43.027922+00:00",
  "status": "completed",
  "api_request_ids": [
    "req_fe3b60a4a46848ccaef44475080acc0c"
  ],
  "retries": [],
  "errors": [],
  "agent_tokens": {
    "input": 753,
    "output": 44,
    "cached_input": 0
  },
  "npc_tokens_or_unavailable": "unavailable",
  "estimated_cost_usd": 0.00076275,
  "cost_status": "estimated",
  "latency_ms": 1202,
  "checkpoint_vector": {
    "artifact_complete": true,
    "answer_exact": false,
    "no_unnecessary_contact": true
  },
  "behavior_metrics": {
    "episode_outcome": "submitted",
    "ask_count": 0,
    "task_success": false,
    "underhelp": false,
    "missing_required_information": null,
    "missing_required_approval": null,
    "optional_quality_points": null,
    "premature_approval_request": null,
    "overhelp": false,
    "first_contact_valid": null,
    "checkpoint_score": 2
  },
  "artifact_refs": {
    "trace": "episodes/formal-r0-openai-nohelp-leave-balance-202610250129-rep1-20261025v1/trace_events.jsonl",
    "answer": "episodes/formal-r0-openai-nohelp-leave-balance-202610250129-rep1-20261025v1/answer.json",
    "evaluation": "episodes/formal-r0-openai-nohelp-leave-balance-202610250129-rep1-20261025v1/evaluation.json",
    "visible_instance": "episodes/formal-r0-openai-nohelp-leave-balance-202610250129-rep1-20261025v1",
    "request_response": "episodes/formal-r0-openai-nohelp-leave-balance-202610250129-rep1-20261025v1/api_io.jsonl",
    "model_turns": "episodes/formal-r0-openai-nohelp-leave-balance-202610250129-rep1-20261025v1/model_turns.jsonl",
    "prompt_snapshot": "episodes/formal-r0-openai-nohelp-leave-balance-202610250129-rep1-20261025v1/prompt_snapshot.json",
    "cost_ledger": "cost_ledger.jsonl"
  },
  "retry_of": null,
  "supersedes": null,
  "exclusion_reason": null,
  "pricing_snapshot": {
    "date": "2026-10-25",
    "rates_per_million_tokens": {
      "input": 0.75,
      "cached": 0.075,
      "output": 4.5,
      "source": "https://developers.openai.com/api/docs/models/gpt-5.4-mini"
    },
    "reference": "pricing_snapshot.json",
    "taxes_included": false
  }
}
