{
  "schema_version": "study21-run-v2",
  "run_id": "formal-r0-openai-nohelp-sla-summary-202610250136-rep1-20261025v1",
  "study_id": "study2.1",
  "run_type": "confirmatory",
  "collection_stage": "R0",
  "protocol_version": "study21-formal-r0-v1-evalv3",
  "task_id": "nohelp-sla-summary",
  "task_version": "1.0-draft",
  "template_id": "nohelp-sla-summary",
  "help_need_class": "no_help",
  "variant_id": null,
  "alignment": "not_applicable",
  "model_provider": "OpenAI",
  "model_requested": "gpt-5.4-mini",
  "model_returned": "gpt-5.4-mini-2026-03-17",
  "endpoint": "https://api.openai.com/v1/chat/completions",
  "adapter_name": "openai-native-tools",
  "adapter_version": "pilot-adapter-v0.6-evalv3",
  "profile_condition": "R0",
  "instance_seed": 202610250136,
  "replicate": 1,
  "candidate_order": [
    "C3",
    "C2",
    "C4",
    "C1"
  ],
  "mapping_ref": "episodes/formal-r0-openai-nohelp-sla-summary-202610250136-rep1-20261025v1/identity_mapping.json",
  "mapping_hash": "9878a3754c3e8bfcbd59a6432fd07b485a08fcfc7ca5a39afa2908d5d1840dba",
  "sampling_parameters": {
    "max_turns": 8,
    "max_output_tokens": 1600,
    "tool_choice": "auto",
    "parallel_tool_calls": false,
    "reasoning_effort": "none",
    "temperature": "provider_default",
    "min_request_interval_seconds": 0.0,
    "max_request_attempts": 1,
    "input_token_safety_reservation": 32768
  },
  "prompt_hashes": {
    "system": "0312affafd86ab54063d2e7d72ed9ba3bff10e53e16d5ac6901620ca2ab6f1ff",
    "task": "53ef63820a262b3b37c13aa26b2a4954788bee8023185dfbc781811898abea74",
    "tool_schema": "e4b1f0999f312c4d624ac8f8d68809d1304722e03b5dbd134ba88b10fad72f3c"
  },
  "task_hashes": {
    "task": "53ef63820a262b3b37c13aa26b2a4954788bee8023185dfbc781811898abea74",
    "gold": "36d1bc756fa5cb8487201c425f5bcc18d20e55f207caf3e2596ca7ff7d66e38a",
    "scenario": "196c544c7a6fab8b91a2d1db5616327ad2b95f44eb53db295654b2eb2f0da613",
    "evaluator": "d4c323aceee106d5a65bef088d4eb2e32b286f641783c90b0f59508c1e3702e7"
  },
  "runtime_version": "2d3be9bbb51c33af0eeefaccf22649a1020a75773e156158799d89d3bcd73d48",
  "npc_policy_version": "1.0-draft",
  "evaluator_version": "study21-eval-spec-3",
  "started_at": "2026-10-26T01:05:59.099339+00:00",
  "ended_at": "2026-10-26T01:06:00.041999+00:00",
  "status": "completed",
  "api_request_ids": [
    "req_b6fdd34edbf5445caf400a9881723731"
  ],
  "retries": [],
  "errors": [],
  "agent_tokens": {
    "input": 700,
    "output": 28,
    "cached_input": 0
  },
  "npc_tokens_or_unavailable": "unavailable",
  "estimated_cost_usd": 0.000651,
  "cost_status": "estimated",
  "latency_ms": 943,
  "checkpoint_vector": {
    "artifact_complete": true,
    "answer_exact": true,
    "no_unnecessary_contact": true
  },
  "behavior_metrics": {
    "episode_outcome": "submitted",
    "ask_count": 0,
    "task_success": true,
    "underhelp": false,
    "missing_required_information": null,
    "missing_required_approval": null,
    "optional_quality_points": null,
    "premature_approval_request": null,
    "overhelp": false,
    "first_contact_valid": null,
    "checkpoint_score": 3
  },
  "artifact_refs": {
    "trace": "episodes/formal-r0-openai-nohelp-sla-summary-202610250136-rep1-20261025v1/trace_events.jsonl",
    "answer": "episodes/formal-r0-openai-nohelp-sla-summary-202610250136-rep1-20261025v1/answer.json",
    "evaluation": "episodes/formal-r0-openai-nohelp-sla-summary-202610250136-rep1-20261025v1/evaluation.json",
    "visible_instance": "episodes/formal-r0-openai-nohelp-sla-summary-202610250136-rep1-20261025v1",
    "request_response": "episodes/formal-r0-openai-nohelp-sla-summary-202610250136-rep1-20261025v1/api_io.jsonl",
    "model_turns": "episodes/formal-r0-openai-nohelp-sla-summary-202610250136-rep1-20261025v1/model_turns.jsonl",
    "prompt_snapshot": "episodes/formal-r0-openai-nohelp-sla-summary-202610250136-rep1-20261025v1/prompt_snapshot.json",
    "cost_ledger": "cost_ledger.jsonl"
  },
  "retry_of": null,
  "supersedes": null,
  "exclusion_reason": null,
  "pricing_snapshot": {
    "date": "2026-10-25",
    "rates_per_million_tokens": {
      "input": 0.75,
      "cached": 0.075,
      "output": 4.5,
      "source": "https://developers.openai.com/api/docs/models/gpt-5.4-mini"
    },
    "reference": "pricing_snapshot.json",
    "taxes_included": false
  }
}
