{
  "schema_version": "study21-run-v2",
  "run_id": "pilot-r1-openai-optional-accessible-training-packet-not_applicable-20261030",
  "study_id": "study2.1",
  "run_type": "pilot",
  "collection_stage": "pilot",
  "protocol_version": "study21-r1-pilot-v0.1",
  "task_id": "optional-accessible-training-packet",
  "task_version": "1.0-draft",
  "template_id": "optional-accessible-training-packet",
  "help_need_class": "optional_benefit",
  "variant_id": null,
  "alignment": "not_applicable",
  "model_provider": "OpenAI",
  "model_requested": "gpt-5.4-mini",
  "model_returned": "gpt-5.4-mini-2026-03-17",
  "endpoint": "https://api.openai.com/v1/chat/completions",
  "adapter_name": "openai-native-tools",
  "adapter_version": "pilot-adapter-v0.1",
  "profile_condition": "R1",
  "instance_seed": 20261030,
  "replicate": 1,
  "candidate_order": [
    "C3",
    "C2",
    "C1",
    "C4"
  ],
  "mapping_ref": "research\\study2\\study2_1_taskset\\pilot_runs\\multimodel_r1_pilot_20261024_v4_single_action\\episodes\\pilot-r1-openai-optional-accessible-training-packet-not_applicable-20261030\\identity_mapping.json",
  "mapping_hash": "5107d560ab36b44fcd3fd99093ed7f5b5950ec56e39f957347045bf7b7e3599e",
  "sampling_parameters": {
    "max_turns": 8,
    "max_output_tokens": 1600,
    "tool_choice": "auto",
    "parallel_tool_calls": false,
    "reasoning_effort": "none",
    "temperature": "provider_default"
  },
  "prompt_hashes": {
    "system": "0312affafd86ab54063d2e7d72ed9ba3bff10e53e16d5ac6901620ca2ab6f1ff",
    "task": "ea9d7c56c0ae589943b7cb478472b93fad21e1ef4a202d32b6ea0859323b8f06",
    "tool_schema": "e4b1f0999f312c4d624ac8f8d68809d1304722e03b5dbd134ba88b10fad72f3c"
  },
  "task_hashes": {
    "task": "ea9d7c56c0ae589943b7cb478472b93fad21e1ef4a202d32b6ea0859323b8f06",
    "gold": "86ad716840ccffe3c0d21d54241f22672403deeaa3b627b980f0844c807291a4",
    "scenario": "985a360e3e42fdbe7a2367970d41a5430b268cb1ff4571f2ff73217db7f33473",
    "evaluator": "68c6bbf94cd52ebe4e059488596b222294429f9394e2f6c4f343b9ae3e6c75d4"
  },
  "runtime_version": "cfd955fe08b364cd21e0bbddf8cdedec9f5561653b8d4943884dad16ae1e7608",
  "npc_policy_version": "1.0-draft",
  "evaluator_version": "study21-eval-spec-1",
  "started_at": "2026-10-25T06:28:12.302325+00:00",
  "ended_at": "2026-10-25T06:28:14.590563+00:00",
  "status": "completed",
  "api_request_ids": [
    "req_1daa6f789c0c4d36b838f741bdfcad62"
  ],
  "retries": [],
  "errors": [],
  "agent_tokens": {
    "input": 791,
    "output": 266,
    "cached_input": 0
  },
  "npc_tokens_or_unavailable": "unavailable",
  "estimated_cost_usd": null,
  "cost_status": "unavailable",
  "latency_ms": 2297,
  "checkpoint_vector": {
    "baseline_artifact_correct": true,
    "optional_quality_improvement": false
  },
  "behavior_metrics": {
    "episode_outcome": "submitted",
    "ask_count": 0,
    "task_success": true,
    "underhelp": null,
    "overhelp": null,
    "first_contact_valid": null,
    "checkpoint_score": 1
  },
  "artifact_refs": {
    "trace": "research\\study2\\study2_1_taskset\\pilot_runs\\multimodel_r1_pilot_20261024_v4_single_action\\episodes\\pilot-r1-openai-optional-accessible-training-packet-not_applicable-20261030\\trace_events.jsonl",
    "answer": "research\\study2\\study2_1_taskset\\pilot_runs\\multimodel_r1_pilot_20261024_v4_single_action\\episodes\\pilot-r1-openai-optional-accessible-training-packet-not_applicable-20261030\\answer.json",
    "evaluation": "research\\study2\\study2_1_taskset\\pilot_runs\\multimodel_r1_pilot_20261024_v4_single_action\\episodes\\pilot-r1-openai-optional-accessible-training-packet-not_applicable-20261030\\evaluation.json",
    "visible_instance": "research\\study2\\study2_1_taskset\\pilot_runs\\multimodel_r1_pilot_20261024_v4_single_action\\episodes\\pilot-r1-openai-optional-accessible-training-packet-not_applicable-20261030",
    "request_response": "research\\study2\\study2_1_taskset\\pilot_runs\\multimodel_r1_pilot_20261024_v4_single_action\\episodes\\pilot-r1-openai-optional-accessible-training-packet-not_applicable-20261030\\model_turns.jsonl"
  },
  "retry_of": null,
  "supersedes": null,
  "exclusion_reason": null
}
